{
  "schema_version": 1,
  "id": "async-and-send",
  "title": "Async & Send",
  "description": "Futures, ownership across .await, and what Send really promises.",
  "toolchain": "1.97.1",
  "order": [
    "async-and-send.004",
    "async-and-send.001",
    "async-and-send.005",
    "async-and-send.002",
    "async-and-send.003"
  ],
  "icon": "paperplane.fill",
  "accent": "blue"
}
