{
  "schema_version": 1,
  "id": "pattern-matching",
  "title": "Pattern Matching",
  "description": "Take data apart with patterns and cover every case.",
  "toolchain": "1.97.1",
  "order": [
    "pattern-matching.004",
    "pattern-matching.001",
    "pattern-matching.002",
    "pattern-matching.003"
  ],
  "icon": "puzzlepiece.fill",
  "accent": "mint"
}
