{
  "schema_version": 1,
  "id": "structs-and-enums",
  "title": "Structs & Enums",
  "description": "Shape your data: fields, methods, variants, and a first match.",
  "toolchain": "1.97.1",
  "order": [
    "structs-and-enums.001",
    "structs-and-enums.002",
    "structs-and-enums.003",
    "structs-and-enums.004",
    "structs-and-enums.005",
    "structs-and-enums.006"
  ],
  "icon": "square.grid.2x2",
  "accent": "yellow",
  "level": "foundations"
}
